{
  "date": "2026-09-05",
  "total": 4,
  "source": "2026-09-05.md",
  "questions": [
    {
      "id": "q1",
      "q": "2026年9月，习近平主席出席上海合作组织峰会并对哪些国家进行国事访问？",
      "options": [
        "吉尔吉斯斯坦和埃及",
        "哈萨克斯坦和乌兹别克斯坦",
        "塔吉克斯坦和伊朗",
        "巴基斯坦和沙特阿拉伯"
      ],
      "answer": 0,
      "analysis": "材料明确提到习近平主席出席2026年上海合作组织峰会并对吉尔吉斯斯坦、埃及进行国事访问。",
      "topic": "外交"
    },
    {
      "id": "q2",
      "q": "根据材料，2026年亚太媒体高端论坛在哪里开幕，有多少人参加？",
      "options": [
        "广州，300人",
        "深圳，400人",
        "上海，500人",
        "北京，600人"
      ],
      "answer": 1,
      "analysis": "材料指出亚太媒体高端论坛在深圳开幕，400人齐聚。",
      "topic": "国际交流"
    },
    {
      "id": "q3",
      "q": "材料中提到的“首个化妆品强制性国家标准”主要针对哪类产品？",
      "options": [
        "成人护肤品",
        "儿童化妆品",
        "防晒产品",
        "染发剂"
      ],
      "answer": 1,
      "analysis": "材料明确提到“首个化妆品强制性国家标准来了！儿童化妆品怎么选？”，因此针对儿童化妆品。",
      "topic": "民生"
    },
    {
      "id": "q4",
      "q": "材料中提及的“动力电池产业步入2.0时代”反映了哪个领域的新风向？",
      "options": [
        "新能源汽车",
        "人工智能",
        "生物医药",
        "航空航天"
      ],
      "answer": 0,
      "analysis": "动力电池是新能源汽车的核心部件，材料标题直接关联动力电池产业，故属于新能源汽车领域。",
      "topic": "产业创新"
    }
  ]
}